titulo	descripcion	ref_id	slug_region	slug_grupo	comentarios
Mariposas	Colombia es el país con mayor diversidad de mariposas en el mundo. Se han registrado 3.642 especies, que corresponden a 19,4 % del total del planeta.	13	home	mariposas	
Aves	Las aves son el grupo biológico con mayor cantidad de registros biológicos. 9'505.381 observaciones se han publicado a través del SiB Colombia, 86 % han sido aportados por la iniciativa ciudadana eBird Colombia.		home	aves	
Orquídeas	En Colombia se encuentran 4.300 especies de orquídeas. Esta cifra, que ha crecido rápidamente los últimos años, supera a países de mayor tamaño como China o India.	41	home	orquideas	
Palmas	De las 289 especies de palmas encontradas en el país, 161 se usan en alimentos, materiales de construcción o materias primas. Al menos 25 son sujetos de algún tipo de comercio.	51	home	palmas	
Plantas	Colombia es uno de los países con mayor diversidad de plantas del planeta. Se han registrado 29.769 especies entre plantas y líquenes.	60	home	plantas	
Plantas	Desde 2016, se han catalogado más de 28.000 especies de plantas y 47.000 nombres científicos para especies, subespecies, híbridos y variedades.	60	home	plantas	
Anfibios	Colombia ocupa el segundo puesto en variedad de anfibios. A través del SiB Colombia se han publicado 155.854 observaciones que representan 887 especies, entre ranas, salamandras y cecilias; frente a 866 disponibles en la literatura.	3| 52	home	anfibios	
Reptiles	En el país se han reportado 638 especies de reptiles. De las 10.000 disponibles en reptile-database, Colombia aporta aproximadamente 5 %.	6	home	reptiles	
Mamíferos	543 especies de mamíferos, validadas por la Sociedad Colombiana de Mastozoología. ubican al país en el quinto puesto a nivel mundial.	55	home	mamiferos	
Peces dulceacuícolas	Segundo país con mayor número de peces dulceacuícolas. 764 encontrados en la región hidrografíca de la Amazonía.	2 | 10	colombia_bibliografia	peces-dulceacuicolas	
Frutos silvestres comestibles	703 especies de frutos comestibles registrados; 45 de estos son endémicos.	66	colombia_bibliografia	ranking-plantas	1° Fabaceae: 66 especies. 2° Arecaceae: 58 especies. 3° Passifloraceae: 44 especies. 4° Sapotaceae: 41 especies. 5° Moraceae: 34 especies.
Frutos silvestres comestibles	388 especies de frutos comestibles están registradas en la Amazonía, 144 en los Andes y 11 en el Pacífico.	66	colombia_bibliografia	ranking-plantas	
307 anuros con cantos de anuncio	307 especies de ranas registradas con 296 estudios relacionados a sus cantos de anuncio.	67	colombia_bibliografia	ranking-anfibios	
Mamíferos marinos en Colombia	Aproximadamente 35 especies de mamíferos marinos, 29 especies registradas en el Caribe y 32 en el Pacífico.	9	colombia_bibliografia	ranking-mamiferos	
Mamíferos marinos en Colombia	23 especies de mamíferos marinos se encuentran reportadas dentro de los apéndices CITES por ser objetos de comercio.	9	colombia_bibliografia	ranking-mamiferos	
	21 de las 30 especies de Zamias reportadas, se encuentran amenazadas según la categoría nacional.		colombia_calculadas		
	108 de las 190 especies de corales reportadas, hacen parte del apéndice II de CITES por ser especies con objeto de comercio.		colombia_calculadas		
	83% de las especies de anfibios reportadas se encuentran dentro de alguna de las categorías de la Lista Roja de la IUCN.		colombia_calculadas		
	1'529.974 registros y 20.309 especies reportadas provienen del departamento de Antioquia.		colombia_calculadas		
	1.5% del total de las especies reportadas se encuentran amenazadas según las categorías nacionales y el 3.66% está en alguno de los apéndices CITES.		colombia_calculadas		
	La mayor cantidad de observaciones de aves la realiza la iniciativa de ciencia ciudadana “eBird” seguida por el Instituto de Investigación de Recursos Biológicos Alexander von Humboldt y la Universidad Nacional de Colombia.		colombia_calculadas		
	El National Museum of Natural History, Smithsonian Institution es la organización internacional que más registros aporta.		colombia_calculadas		
	La Universidad Nacional de Colombia, el National Museum of Natural History - Smithsonian Institution y Missouri Botanical Garden son las organizaciones que reportaron la mayor cantidad de especies.		colombia_calculadas		
	En los páramos de Boyacá se han observado especies emblemáticas de Colombia como el frailejón y el oso andino.		boyaca		
	Cerca del 30 % de las especies de mamíferos y reptiles del país se encuentran en este departamento.		boyaca		
	El municipio de Santa María, ha hecho el mayor número de observaciones de la región, lo que corresponde al 14 % de los datos disponibles.		boyaca		
	El municipio con mayor número de observaciones de aves migratorias es Santa María.		boyaca		
	Más del 50 % de las especies endémicas están en estado de amenaza.		boyaca		
	Más de 400 especies se encuentran reguladas, por ser objeto de comercio.		boyaca		
	El 9 % de las especies presentes en Boyacá son endémicas en Colombia.		boyaca		
	Cada año, 91 aves migratorias visitan Boyacá.		boyaca		
	La especie de papa, Solanum tuberosum, es una especie exótica clave para la seguridad alimentaria.		boyaca		
	173 organizaciones han aportado datos sobre la biodiversidad de Boyacá.		boyaca		
	El Sirirí común, Tyrannus melancholicus, es el ave con mayor número de observaciones a través de aplicaciones de ciencia participativa.		boyaca		
	Cerca del 75 % de las entidades que aportan datos para Boyacá son internacionales lo que representa el 11 % de la información total.		boyaca		
	El “hongo matamoscas”, Amanita muscari, es la especie con mayor cantidad de observaciones hechas, a través de la plataforma de ciencia participativa: iNaturalist.		boyaca		
	El roble colombiano, árbol endémico de los Andes, es la planta con mayor cantidad de observaciones en el departamento.		santander		
	Una tercera parte de las especies de frailejones, están en Santander.		santander		
	Charalá, municipio que hace parte del patrimonio histórico de Colombia, es donde mayor cantidad de especies endémicas se han observado.		santander		
	Se han registrado más de 900 especies de insectos en el departamento.		santander		
	11 % de las especies endémicas de Santander se encuentran en estado de amenaza.		santander		
	En el departamento, se registran 13 especies de árboles maderables, 12 de ellos se encuentran en estado de amenaza.		santander		
	El 30% de las especies endémicas de aves y peces de Colombia, se encuentran en este departamento.		santander		
	Cada año, 86 aves migratorias visitan Santander.		santander		
	La especie de rana, “Coquí de las Antillas”, es la especie exótica con mayor cantidad de registros biológicos en el departamento.		santander		
	La palma de cera, especie endémica del departamento, además de ser la planta con mayor cantidad de observaciones, se encuentra en peligro.		tolima		
	El gallinazo negro, Coragyps atratus, es el ave con mayor número de observaciones registradas.		tolima		
	Cajamarca es el municipio con mayor cantidad de registros biológicos en del departamento.		tolima		
	Ibagué cuenta con la mayor cantidad de especies endémicas y migratorias del Tolima.		tolima		
	El 10% de las aves en Tolima son migratorias.		tolima		
	La Garcita del ganado o Garza ganadera es la especie exótica con mayor cantidad de observaciones reportadas a través del SiB Colombia.		tolima		
	La Universidad Nacional de Colombia reporta el 38 % de las especies presentes en Tolima.		tolima		
	eBird Colombia, una iniciativa de ciencia ciudadana, es la organización que reporta la mayor cantidad de observaciones de aves.		tolima		
	7 especies de árboles maderables se encuentran en estado de amenaza.		tolima		
	El 50 % de las especies de peces del Tolima son endémicas en Colombia.		tolima		
	El 40% de las especies de mamíferos encontradas en el país están presentes en este departamento.		tolima		
	El 48 % de las orquídeas en Tolima se encuentran amparadas en los apéndices CITES por ser especies objeto de comercio.		tolima		
	Los escarabajos son el grupo con mayor cantidad de observaciones. Sin embargo, las mariposas aportan el 53% de las especies de insectos para Tolima.		tolima		
	La Universidad de Caldas es la entidad nacional que mayor cantidad de registros ha aportado.		tolima		
	181 de las 290 especies de peces reportadas, son marinas.		narino		
	El arbusto Faramea coffeoides, es la planta con el mayor cantidad de observaciones.		narino		
	Barbacoas es el municipio con mayor cantidad de especies registradas geolocalizadas, seguido por San Andrés de Tumaco y Ricaurte.		narino		
	En este departamento se pueden observar ballenas azules (Balaenoptera musculus), de aleta (Balaenoptera physalus) y jorobadas (Megaptera novaeangliae); todas se encuentran dentro de alguna categoría de amenaza.		narino		
	La entidad que más registros biológicos ha aportado es el Instituto de Investigación de Recursos Biológicos Alexander von Humboldt.		narino		
	La Universidad de Nariño es la organización académica con mayor cantidad de registros biológicos publicados.		narino		
	Las organizaciones internacionales aportan 6 % del total de las observaciones para el departamento.		narino		
	60 % de los registros provienen del municipio de Ricaurte.		narino		
	La planta Saurauia parviflora es la especie endémica con mayor cantidad de observaciones.		narino		
	426 especies se encuentran en los apéndices CITES, por ser objeto de comercio.		narino		
	83 % de las especies migratorias pueden observarse en San Andrés de Tumaco		narino		
	El Tucán Andino (Andigena laminirostris) es la especie catalogada En Peligro, según la lista UICN, con mayor cantidad de observaciones.		narino		
	Las plantas constituyen 65 % del total de las especies reportadas en el departamento.		narino		
	El grupo biologico con mayor cantidad de observaciones son las plantas. Siendo Faramea coffeoides la especie más observada		reserva-forestal-la-planada		
	El 96% de las observaciones para la Reserva Forestal Protectora La Planada son aportadas por el Instituto de Investigación de Recursos Biológicos Alexander von Humboldt		reserva-forestal-la-planada		
	La organización internacional que más observaciones ha realizado para la Reserva Forestal Protectora La Planada es el Missouri Botanical Garden		reserva-forestal-la-planada		
	La Universidad de Nariño es la organización académica que mayor cantidad de especies ha observado en la Reserva Forestal Protectora La Planada		reserva-forestal-la-planada		
	De las 37 especies de orquídeas encontradas, 16 se encuentran amparadas en los apéndices CITES por ser especies objeto de comercio		reserva-forestal-la-planada		
	Henicorhina leucophrys es el ave con mayor cantidad de observaciones		reserva-forestal-la-planada		
	Andigena laminirostris, un tucán de tierras altas conocido como Terlaque cuenta con 131 observaciones dentro de la reserva		reserva-forestal-la-planada		
	Otoba lehmannii es la especie con categoría de amenaza nacional Vulnerable con mayor número de observaciones		reserva-forestal-la-planada		
	Dentro de la reserva se pueden encontrar 73 especies endémicas para el país		reserva-forestal-la-planada		
	En la reserva se pueden encontrar 24 especies de aves migratorias		reserva-forestal-la-planada		
	En el Resguardo Indígena Pialapí Pueblo Viejo se encuentran 254 especies de plantas		resguardo-indigena-pialapi-pueblo-viejo		
	Las tres organizaciones que han observado mayor cantidad de especies dentro del resguardo son: Missouri Botanical Garden, National Museum of Natural History, Smithsonian Institution y la Universidad de Nariño		resguardo-indigena-pialapi-pueblo-viejo		
	El Missouri Botanical Garden aporta el 41,6% del total de observaciones para el resguardo		resguardo-indigena-pialapi-pueblo-viejo		
	Sturnira erythromos es la especie con mayor número de observaciones dentro del resguardo		resguardo-indigena-pialapi-pueblo-viejo		
	Dentro del resguardo se pueden encontrar 28 especies endémicas para el país		resguardo-indigena-pialapi-pueblo-viejo		
	5 especies encontradas dentro del resguardo se encuentran amparadas en los apéndices CITES por ser especies objeto de comercio		resguardo-indigena-pialapi-pueblo-viejo		
